{
  "repository": "173787247/dsh-wsl-clock",
  "repository_id": 1351854066,
  "captured_at": "2026-10-20T07:15:30.299Z",
  "window_start": "2026-09-20T07:15:30.299Z",
  "stars": 1,
  "pushed_at": "2026-09-29T15:03:46Z",
  "issues": {
    "open": 0,
    "closed": 0,
    "created_30d": 0,
    "closed_30d": 0,
    "updated_30d": 0
  },
  "errors": [],
  "npm": {
    "package_name": "dsh-wsl-clock",
    "captured_at": "2026-10-20T07:15:30.299Z",
    "window_start": "2026-09-20",
    "window_end": "2026-10-19",
    "downloads_30d": null,
    "source_url": "https://api.npmjs.org/downloads/point/2026-09-20:2026-10-19/dsh-wsl-clock",
    "error": "HTTP 404",
    "publication": {
      "first_published_at": null,
      "captured_at": "2026-10-20T07:15:30.299Z",
      "source_url": "https://registry.npmjs.org/dsh-wsl-clock",
      "error": "HTTP 404"
    }
  },
  "code_update": {
    "checked_at": "2026-10-20T07:15:30.299Z",
    "baseline_revision": "111cc4c013ef17a495c8790fbfa6373d7abbdebc",
    "current_revision": "111cc4c013ef17a495c8790fbfa6373d7abbdebc",
    "script_changed": false,
    "changed_files": [],
    "error": null
  }
}
