{
  "repository": "173787247/dsh-wsl-dns",
  "repository_id": 1351854118,
  "captured_at": "2026-10-20T06:08:58.680Z",
  "window_start": "2026-09-20T06:08:58.680Z",
  "stars": 1,
  "pushed_at": "2026-09-29T15:04:19Z",
  "issues": {
    "open": null,
    "closed": null,
    "created_30d": null,
    "closed_30d": null,
    "updated_30d": null
  },
  "errors": [
    {
      "target": "open",
      "message": "GitHub request failed for search/issues?q=repo%3A173787247%2Fdsh-wsl-dns%20is%3Aissue%20is%3Aopen&per_page=1: gh: API rate limit exceeded for installation. If you reach out to GitHub Support for help, please include the request ID 7C33:38DA9C:19062C:524B64:6AD70603 and timestamp 2026-10-20 06:11:15 UTC. For more on scraping GitHub and how it may affect your rights, please review our Terms of Service (https://docs.github.com/en/site-policy/github-terms/github-terms-of-service) (HTTP 403)"
    },
    {
      "target": "closed",
      "message": "GitHub request failed for search/issues?q=repo%3A173787247%2Fdsh-wsl-dns%20is%3Aissue%20is%3Aclosed&per_page=1: gh: API rate limit exceeded for installation. If you reach out to GitHub Support for help, please include the request ID 7C47:355364:19DE1D:543739:6AD70603 and timestamp 2026-10-20 06:11:15 UTC. For more on scraping GitHub and how it may affect your rights, please review our Terms of Service (https://docs.github.com/en/site-policy/github-terms/github-terms-of-service) (HTTP 403)"
    },
    {
      "target": "created_30d",
      "message": "GitHub request failed for search/issues?q=repo%3A173787247%2Fdsh-wsl-dns%20is%3Aissue%20created%3A2026-09-20T06%3A08%3A58.680Z..2026-10-20T06%3A08%3A58.680Z&per_page=1: gh: API rate limit exceeded for installation. If you reach out to GitHub Support for help, please include the request ID 7C48:12851:190ABB:51627C:6AD70603 and timestamp 2026-10-20 06:11:15 UTC. For more on scraping GitHub and how it may affect your rights, please review our Terms of Service (https://docs.github.com/en/site-policy/github-terms/github-terms-of-service) (HTTP 403)"
    },
    {
      "target": "closed_30d",
      "message": "GitHub request failed for search/issues?q=repo%3A173787247%2Fdsh-wsl-dns%20is%3Aissue%20is%3Aclosed%20closed%3A2026-09-20T06%3A08%3A58.680Z..2026-10-20T06%3A08%3A58.680Z&per_page=1: gh: API rate limit exceeded for installation. If you reach out to GitHub Support for help, please include the request ID 7C49:31331D:191E75:51DEBB:6AD70603 and timestamp 2026-10-20 06:11:15 UTC. For more on scraping GitHub and how it may affect your rights, please review our Terms of Service (https://docs.github.com/en/site-policy/github-terms/github-terms-of-service) (HTTP 403)"
    },
    {
      "target": "updated_30d",
      "message": "GitHub request failed for search/issues?q=repo%3A173787247%2Fdsh-wsl-dns%20is%3Aissue%20updated%3A2026-09-20T06%3A08%3A58.680Z..2026-10-20T06%3A08%3A58.680Z&per_page=1: gh: API rate limit exceeded for installation. If you reach out to GitHub Support for help, please include the request ID 7C4A:D8648:1A077F:55064C:6AD70604 and timestamp 2026-10-20 06:11:16 UTC. For more on scraping GitHub and how it may affect your rights, please review our Terms of Service (https://docs.github.com/en/site-policy/github-terms/github-terms-of-service) (HTTP 403)"
    }
  ],
  "npm": {
    "package_name": "dsh-wsl-dns",
    "captured_at": "2026-10-20T06:08:58.680Z",
    "window_start": "2026-09-20",
    "window_end": "2026-10-19",
    "downloads_30d": null,
    "source_url": "https://api.npmjs.org/downloads/point/2026-09-20:2026-10-19/dsh-wsl-dns",
    "error": "HTTP 404",
    "publication": {
      "first_published_at": null,
      "captured_at": "2026-10-20T06:08:58.680Z",
      "source_url": "https://registry.npmjs.org/dsh-wsl-dns",
      "error": "HTTP 404"
    }
  },
  "code_update": {
    "checked_at": "2026-10-20T06:08:58.680Z",
    "baseline_revision": "04d6ff1aff856dd22b78c53013a9286efa0ddc35",
    "current_revision": "04d6ff1aff856dd22b78c53013a9286efa0ddc35",
    "script_changed": false,
    "changed_files": [],
    "error": null
  }
}
