{
  "repository": "439436269-ctrl/dsh-peak-runner",
  "repository_id": 1417227361,
  "captured_at": "2026-10-21T02:01:44.992Z",
  "window_start": "2026-09-21T02:01:44.992Z",
  "stars": 0,
  "pushed_at": "2026-10-13T14:53:23Z",
  "issues": {
    "open": 0,
    "closed": 0,
    "created_30d": 0,
    "closed_30d": 0,
    "updated_30d": 0
  },
  "errors": [],
  "npm": {
    "package_name": "dsh-peak-runner",
    "captured_at": "2026-10-21T02:01:52.963Z",
    "window_start": "2026-09-21",
    "window_end": "2026-10-20",
    "downloads_30d": 24,
    "source_url": "https://api.npmjs.org/downloads/point/2026-09-21:2026-10-20/dsh-peak-runner",
    "error": null,
    "publication": {
      "first_published_at": "2026-10-13T14:33:10.038Z",
      "captured_at": "2026-10-21T02:01:52.963Z",
      "source_url": "https://registry.npmjs.org/dsh-peak-runner",
      "error": null
    }
  }
}
