{
  "repository": "ADWMC/helm-d",
  "repository_id": 1334304098,
  "captured_at": "2026-10-21T04:11:58.948Z",
  "window_start": "2026-09-21T04:11:58.948Z",
  "stars": 285,
  "pushed_at": "2026-10-20T13:23:29Z",
  "issues": {
    "open": null,
    "closed": null,
    "created_30d": null,
    "closed_30d": null,
    "updated_30d": null
  },
  "errors": [
    {
      "target": "open",
      "message": "GitHub request failed for search/issues?q=repo%3AADWMC%2Fhelm-d%20is%3Aissue%20is%3Aopen&per_page=1: gh: API rate limit exceeded for user ID 84020791. If you reach out to GitHub Support for help, please include the request ID ED50:4F21B:45C1D4:4ABC27:6AD83B90 and timestamp 2026-10-21 04:12:00 UTC. For more on scraping GitHub and how it may affect your rights, please review our Terms of Service (https://docs.github.com/en/site-policy/github-terms/github-terms-of-service) (HTTP 403)"
    },
    {
      "target": "closed",
      "message": "GitHub request failed for search/issues?q=repo%3AADWMC%2Fhelm-d%20is%3Aissue%20is%3Aclosed&per_page=1: gh: API rate limit exceeded for user ID 84020791. If you reach out to GitHub Support for help, please include the request ID EE44:AA00D:47D361:4CCDC5:6AD83B91 and timestamp 2026-10-21 04:12:01 UTC. For more on scraping GitHub and how it may affect your rights, please review our Terms of Service (https://docs.github.com/en/site-policy/github-terms/github-terms-of-service) (HTTP 403)"
    },
    {
      "target": "created_30d",
      "message": "GitHub request failed for search/issues?q=repo%3AADWMC%2Fhelm-d%20is%3Aissue%20created%3A2026-09-21T04%3A11%3A58.948Z..2026-10-21T04%3A11%3A58.948Z&per_page=1: gh: API rate limit exceeded for user ID 84020791. If you reach out to GitHub Support for help, please include the request ID EF24:44870:464B19:4B427B:6AD83B92 and timestamp 2026-10-21 04:12:02 UTC. For more on scraping GitHub and how it may affect your rights, please review our Terms of Service (https://docs.github.com/en/site-policy/github-terms/github-terms-of-service) (HTTP 403)"
    },
    {
      "target": "closed_30d",
      "message": "GitHub request failed for search/issues?q=repo%3AADWMC%2Fhelm-d%20is%3Aissue%20is%3Aclosed%20closed%3A2026-09-21T04%3A11%3A58.948Z..2026-10-21T04%3A11%3A58.948Z&per_page=1: gh: API rate limit exceeded for user ID 84020791. If you reach out to GitHub Support for help, please include the request ID F006:4E9B5:464F38:4B475D:6AD83B93 and timestamp 2026-10-21 04:12:03 UTC. For more on scraping GitHub and how it may affect your rights, please review our Terms of Service (https://docs.github.com/en/site-policy/github-terms/github-terms-of-service) (HTTP 403)"
    },
    {
      "target": "updated_30d",
      "message": "GitHub request failed for search/issues?q=repo%3AADWMC%2Fhelm-d%20is%3Aissue%20updated%3A2026-09-21T04%3A11%3A58.948Z..2026-10-21T04%3A11%3A58.948Z&per_page=1: gh: API rate limit exceeded for user ID 84020791. If you reach out to GitHub Support for help, please include the request ID F0CC:272681:437608:486E27:6AD83B93 and timestamp 2026-10-21 04:12:04 UTC. For more on scraping GitHub and how it may affect your rights, please review our Terms of Service (https://docs.github.com/en/site-policy/github-terms/github-terms-of-service) (HTTP 403)"
    }
  ],
  "npm": {
    "package_name": "@adwmc/helm-d",
    "captured_at": "2026-10-21T04:12:03.958Z",
    "window_start": "2026-09-21",
    "window_end": "2026-10-20",
    "downloads_30d": 391,
    "source_url": "https://api.npmjs.org/downloads/point/2026-09-21:2026-10-20/%40adwmc%2Fhelm-d",
    "error": null,
    "publication": {
      "first_published_at": "2026-09-14T17:29:28.998Z",
      "captured_at": "2026-10-21T04:12:03.958Z",
      "source_url": "https://registry.npmjs.org/%40adwmc%2Fhelm-d",
      "error": null
    }
  }
}
