{
  "repository": "2008924/dsh-progress-viz",
  "repository_id": 1334481905,
  "captured_at": "2026-10-20T10:44:47.147Z",
  "window_start": "2026-09-20T10:44:47.147Z",
  "stars": 0,
  "pushed_at": "2026-08-16T21:50:56Z",
  "issues": {
    "open": null,
    "closed": null,
    "created_30d": null,
    "closed_30d": null,
    "updated_30d": 0
  },
  "errors": [
    {
      "target": "open",
      "message": "GitHub request failed for search/issues?q=repo%3A2008924%2Fdsh-progress-viz%20is%3Aissue%20is%3Aopen&per_page=1: gh: API rate limit exceeded for user ID 84020791. If you reach out to GitHub Support for help, please include the request ID 8EE8:3AE55C:3BBEA6:580958:6AD74620 and timestamp 2026-10-20 10:44:48 UTC. For more on scraping GitHub and how it may affect your rights, please review our Terms of Service (https://docs.github.com/en/site-policy/github-terms/github-terms-of-service) (HTTP 403)"
    },
    {
      "target": "closed",
      "message": "GitHub request failed for search/issues?q=repo%3A2008924%2Fdsh-progress-viz%20is%3Aissue%20is%3Aclosed&per_page=1: gh: API rate limit exceeded for user ID 84020791. If you reach out to GitHub Support for help, please include the request ID 8FA6:333194:3943B3:54D0EA:6AD74621 and timestamp 2026-10-20 10:44:49 UTC. For more on scraping GitHub and how it may affect your rights, please review our Terms of Service (https://docs.github.com/en/site-policy/github-terms/github-terms-of-service) (HTTP 403)"
    },
    {
      "target": "created_30d",
      "message": "GitHub request failed for search/issues?q=repo%3A2008924%2Fdsh-progress-viz%20is%3Aissue%20created%3A2026-09-20T10%3A44%3A47.147Z..2026-10-20T10%3A44%3A47.147Z&per_page=1: gh: API rate limit exceeded for user ID 84020791. If you reach out to GitHub Support for help, please include the request ID 9044:3740AB:39DDC4:5602CD:6AD74622 and timestamp 2026-10-20 10:44:50 UTC. For more on scraping GitHub and how it may affect your rights, please review our Terms of Service (https://docs.github.com/en/site-policy/github-terms/github-terms-of-service) (HTTP 403)"
    },
    {
      "target": "closed_30d",
      "message": "GitHub request failed for search/issues?q=repo%3A2008924%2Fdsh-progress-viz%20is%3Aissue%20is%3Aclosed%20closed%3A2026-09-20T10%3A44%3A47.147Z..2026-10-20T10%3A44%3A47.147Z&per_page=1: gh: API rate limit exceeded for user ID 84020791. If you reach out to GitHub Support for help, please include the request ID 9120:3AE55C:3BC0CC:580CBE:6AD74623 and timestamp 2026-10-20 10:44:51 UTC. For more on scraping GitHub and how it may affect your rights, please review our Terms of Service (https://docs.github.com/en/site-policy/github-terms/github-terms-of-service) (HTTP 403)"
    }
  ],
  "npm": {
    "package_name": "dsh-progress-viz-plugin",
    "captured_at": "2026-10-20T10:44:52.878Z",
    "window_start": "2026-09-20",
    "window_end": "2026-10-19",
    "downloads_30d": null,
    "source_url": "https://api.npmjs.org/downloads/point/2026-09-20:2026-10-19/dsh-progress-viz-plugin",
    "error": "HTTP 404",
    "publication": {
      "first_published_at": null,
      "captured_at": "2026-10-20T10:44:52.878Z",
      "source_url": "https://registry.npmjs.org/dsh-progress-viz-plugin",
      "error": "HTTP 404"
    }
  }
}
