{
  "repository": "173787247/dsh-wsl-compose",
  "repository_id": 1381842592,
  "captured_at": "2026-10-21T05:08:56.162Z",
  "window_start": "2026-09-21T05:08:56.162Z",
  "stars": 1,
  "pushed_at": "2026-09-30T03:21:43Z",
  "issues": {
    "open": null,
    "closed": null,
    "created_30d": null,
    "closed_30d": null,
    "updated_30d": null
  },
  "errors": [
    {
      "target": "open",
      "message": "GitHub request failed for search/issues?q=repo%3A173787247%2Fdsh-wsl-compose%20is%3Aissue%20is%3Aopen&per_page=1: gh: API rate limit exceeded for installation. If you reach out to GitHub Support for help, please include the request ID 6410:3A339B:137E2B:20F091:6AD8495F and timestamp 2026-10-21 05:10:55 UTC. For more on scraping GitHub and how it may affect your rights, please review our Terms of Service (https://docs.github.com/en/site-policy/github-terms/github-terms-of-service) (HTTP 403)"
    },
    {
      "target": "closed",
      "message": "GitHub request failed for search/issues?q=repo%3A173787247%2Fdsh-wsl-compose%20is%3Aissue%20is%3Aclosed&per_page=1: gh: API rate limit exceeded for installation. If you reach out to GitHub Support for help, please include the request ID 6412:9ED8B:145CAF:21D82C:6AD84960 and timestamp 2026-10-21 05:10:56 UTC. For more on scraping GitHub and how it may affect your rights, please review our Terms of Service (https://docs.github.com/en/site-policy/github-terms/github-terms-of-service) (HTTP 403)"
    },
    {
      "target": "created_30d",
      "message": "GitHub request failed for search/issues?q=repo%3A173787247%2Fdsh-wsl-compose%20is%3Aissue%20created%3A2026-09-21T05%3A08%3A56.162Z..2026-10-21T05%3A08%3A56.162Z&per_page=1: gh: API rate limit exceeded for installation. If you reach out to GitHub Support for help, please include the request ID 6413:B65AE:137398:20E98C:6AD84960 and timestamp 2026-10-21 05:10:56 UTC. For more on scraping GitHub and how it may affect your rights, please review our Terms of Service (https://docs.github.com/en/site-policy/github-terms/github-terms-of-service) (HTTP 403)"
    },
    {
      "target": "closed_30d",
      "message": "GitHub request failed for search/issues?q=repo%3A173787247%2Fdsh-wsl-compose%20is%3Aissue%20is%3Aclosed%20closed%3A2026-09-21T05%3A08%3A56.162Z..2026-10-21T05%3A08%3A56.162Z&per_page=1: gh: API rate limit exceeded for installation. If you reach out to GitHub Support for help, please include the request ID 6415:DBD0:156536:22D6BA:6AD84960 and timestamp 2026-10-21 05:10:56 UTC. For more on scraping GitHub and how it may affect your rights, please review our Terms of Service (https://docs.github.com/en/site-policy/github-terms/github-terms-of-service) (HTTP 403)"
    },
    {
      "target": "updated_30d",
      "message": "GitHub request failed for search/issues?q=repo%3A173787247%2Fdsh-wsl-compose%20is%3Aissue%20updated%3A2026-09-21T05%3A08%3A56.162Z..2026-10-21T05%3A08%3A56.162Z&per_page=1: gh: API rate limit exceeded for installation. If you reach out to GitHub Support for help, please include the request ID 6409:194586:14AACD:223E5F:6AD84960 and timestamp 2026-10-21 05:10:56 UTC. For more on scraping GitHub and how it may affect your rights, please review our Terms of Service (https://docs.github.com/en/site-policy/github-terms/github-terms-of-service) (HTTP 403)"
    }
  ],
  "npm": {
    "package_name": "dsh-wsl-compose",
    "captured_at": "2026-10-21T05:08:56.162Z",
    "window_start": "2026-09-21",
    "window_end": "2026-10-20",
    "downloads_30d": null,
    "source_url": "https://api.npmjs.org/downloads/point/2026-09-21:2026-10-20/dsh-wsl-compose",
    "error": "HTTP 404",
    "publication": {
      "first_published_at": null,
      "captured_at": "2026-10-21T05:08:56.162Z",
      "source_url": "https://registry.npmjs.org/dsh-wsl-compose",
      "error": "HTTP 404"
    }
  },
  "code_update": {
    "checked_at": "2026-10-21T05:08:56.162Z",
    "baseline_revision": "bea57df86854983d90c8ac9219d15db1235c1652",
    "current_revision": "bea57df86854983d90c8ac9219d15db1235c1652",
    "script_changed": false,
    "changed_files": [],
    "error": null
  }
}
