{
    "repository": "173787247/dsh-mac-companion",
    "repository_id": 1384810483,
    "captured_at": "2026-10-22T05:54:07.697Z",
    "window_start": "2026-09-22T05:54:07.697Z",
    "stars": 1,
    "pushed_at": "2026-09-30T03:21:33Z",
    "issues": {
        "open": 0,
        "closed": 0,
        "created_30d": 0,
        "closed_30d": 0,
        "updated_30d": 0
    },
    "errors": []
}
