{
  "repository": "7gzgn/dsh-restart-planner",
  "repository_id": 1422176522,
  "captured_at": "2026-10-21T05:08:56.162Z",
  "window_start": "2026-09-21T05:08:56.162Z",
  "stars": 0,
  "pushed_at": "2026-10-18T04:00:47Z",
  "issues": {
    "open": 0,
    "closed": 0,
    "created_30d": 0,
    "closed_30d": 0,
    "updated_30d": 0
  },
  "errors": [],
  "npm": {
    "package_name": "dsh-restart-planner",
    "captured_at": "2026-10-21T05:08:56.162Z",
    "window_start": "2026-09-21",
    "window_end": "2026-10-20",
    "downloads_30d": null,
    "source_url": "https://api.npmjs.org/downloads/point/2026-09-21:2026-10-20/dsh-restart-planner",
    "error": "HTTP 404",
    "publication": {
      "first_published_at": null,
      "captured_at": "2026-10-21T05:08:56.162Z",
      "source_url": "https://registry.npmjs.org/dsh-restart-planner",
      "error": "HTTP 404"
    }
  },
  "code_update": {
    "checked_at": "2026-10-21T05:08:56.162Z",
    "baseline_revision": "31562ec5555d6e93a81c251b39d173b5d80c03c6",
    "current_revision": "31562ec5555d6e93a81c251b39d173b5d80c03c6",
    "script_changed": false,
    "changed_files": [],
    "error": null
  }
}
